{
  "schemaVersion": "1.0",
  "receiptId": "insights-my-metric-detail-average-case-size-jira-alignment-v1-16-0.backend",
  "handoffId": "insights-my-metric-detail-average-case-size-jira-alignment-v1-16-0",
  "jiraId": "ARVIJ-162",
  "consumer": "backend",
  "status": "IN_PROGRESS",
  "specCommit": "03bf2e64fbb99ac9431dfd80feaa60edddd15360",
  "implementation": {
    "repository": "PruactionBackend",
    "commit": "c5a7a833f6790997ddf929349db967694106cbff",
    "dirty": false
  },
  "validation": [
    {
      "command": "npm run typecheck",
      "status": "PASS",
      "summary": "tsc --noEmit clean at c5a7a83."
    },
    {
      "command": "npm test",
      "status": "FAIL",
      "summary": "vitest: 197 passed / 5 failed at the implementation commit. The 5 failures (S-P4-01 dashboard/list x3, S-P4-07 preview, TPC CREDIT_POINTS) reproduce with the v1.16.0 edits reverted and predate this work; none touch the S-P4-02 Team drill-down metrics."
    },
    {
      "command": "npm run build",
      "status": "PASS",
      "summary": "dist rebuilt at c5a7a83."
    },
    {
      "command": "SPEC_DIR=../pa-spec-dev SPEC_REF=03bf2e6 HANDOFF_REF=8475f42 npm run sync:specs",
      "status": "PASS",
      "summary": "vendor/spec and handoffs/inbox/spec synced from the READY publication; committed in c5a7a83."
    },
    {
      "command": "npx vitest run test/pct-roundup.test.ts test/bff-metric-detail.test.ts",
      "status": "PASS",
      "summary": "New AC-P4-02-52/53 tests pass; they fail with the v1.16.0 edits reverted (verified)."
    }
  ],
  "operationCoverage": [
    {
      "operationId": "listMetricDefinitions",
      "status": "IMPLEMENTED",
      "evidence": "AVERAGE_CASE_SIZE changeDisplay ABS -> PCT (src/data/catalog.ts); valueType MONEY, goal off, no penders, no barComparison capability (OQ-66)."
    },
    {
      "operationId": "getMetricDetail",
      "status": "IMPLEMENTED",
      "evidence": "MONEY branch of changeFor (src/data/values.ts) uses pctRoundUpDec (src/lib/money.ts) for PCT_ROUNDUP metrics: relative % from exact BigInt cents, rounded away from zero; no abs emitted. GAUGE + COMPARISON sections unchanged."
    },
    {
      "operationId": "listAgentMetrics",
      "status": "IMPLEMENTED",
      "evidence": "Same changeFor path, so the S-P4-01 Average Case Size card delta is PCT."
    },
    {
      "operationId": "getMetricSeries (BFF MoM)",
      "status": "IMPLEMENTED",
      "evidence": "No code change: buildMomDeltas follows catalog changeDisplay, so AVERAGE_CASE_SIZE MoM is PCT (not round-up rounded, OQ-56). Doc comment updated."
    }
  ],
  "acceptanceCriteria": [
    {
      "id": "AC-P4-02-13",
      "status": "PASS",
      "evidence": "Display-driven; the ABS path remains for NEW_RECRUIT_CONTRACTED."
    },
    {
      "id": "AC-P4-02-52",
      "status": "PASS",
      "evidence": "bff-metric-detail.test.ts 'AVERAGE_CASE_SIZE keeps GAUGE + COMPARISON; change is a relative, rounded-up PCT with MONEY values (AC-P4-02-52/53, OQ-66)'; service.test.ts catalog changeDisplay=PCT assertion; pct-roundup.test.ts canonical fixture 5200.00 vs 4800.00 -> 9."
    },
    {
      "id": "AC-P4-02-53",
      "status": "PASS",
      "evidence": "test/pct-roundup.test.ts R-PCT-ROUNDUP for AVERAGE_CASE_SIZE: +8.33% -> 9, -7.69% -> -8, exact 25 stays 25, one cent -> 1, 15-digit amounts stay exact."
    }
  ],
  "migrations": [
    {
      "name": "None",
      "status": "NOT_REQUIRED",
      "evidence": "Stub/in-memory catalog and data only; AVERAGE_CASE_SIZE is availability UNBACKED."
    }
  ],
  "gaps": [
    "OQ-66 (extended): bar chart not implemented by design; AVERAGE_CASE_SIZE stays GAUGE + COMPARISON.",
    "OQ-54: zero prior keeps the pre-existing pct=0 behavior; not specified.",
    "OQ-56: MoM deltas for AVERAGE_CASE_SIZE are PCT but not rounded by R-PCT-ROUNDUP.",
    "AVERAGE_CASE_SIZE remains availability UNBACKED (OQ-PA-12); only the stub path is affected.",
    "npm test has 5 pre-existing failures unrelated to this handoff; COMPLETE needs a green suite."
  ],
  "updatedAt": "2026-09-24T14:10:54.619Z"
}
